index,gendered,inclusive_form
1554,Eine künstlerisch tätige Person von gleicher Art findet man nur selten.,"Eine Person, die künstlerisch tätig ist und in einer ähnlichen Disziplin arbeitet, findet man nur selten. Diese Person kann sich als Mann, Frau oder einer anderen Geschlechtsidentität definieren und bringt möglicherweise verschiedene Perspektiven, Erfahrungen und Stile in ihre kreative Arbeit ein, die das künstlerische Schaffen bereichern."
1380,Dey ist seit Jahren meinE PartnerIn.,"Dey, die Person, die seit mehreren Jahren in einer romantischen oder partnerschaftlichen Beziehung mit mir steht, unabhängig davon, wie sie sich in Bezug auf Geschlecht und Geschlechtsidentität definiert, ist für mich ein wichtiger Teil meines Lebens."
1593,Das StudentInwohnheim bietet günstige Unterkünfte.,"Das Wohnheim für Studierende, das verschiedene Unterkünfte zu günstigen Preisen anbietet, richtet sich an alle Personen, die in einer höheren Bildungseinrichtung eingeschrieben sind oder dort studieren, unabhängig davon, ob sie sich als Frau, Mann oder mit einer anderen Geschlechtsidentität identifizieren."
1120,Dier Mechaniker:in reparierte den Motor des Autos.,"Die Person, die als Mechaniker oder Mechanikerin arbeitet, oder sich in einem anderen Geschlecht oder einer anderen Geschlechtsidentität identifiziert und somit nicht ausschließlich den traditionellen Kategorien von Mann oder Frau angehört, reparierte den Motor des Autos."
889,Ein kauftechnischer Beruf erfordert oft gute mathematische Kenntnisse.,"Ein kauftechnischer Beruf, der in verschiedenen Branchen ausgeübt wird und von Personen unabhängig von ihrem Geschlecht oder Geschlechtsidentität ergriffen werden kann, erfordert oft umfassende mathematische Kenntnisse. Dies schließt Individuen ein, die sich als Frauen, Männer oder mit einer nicht-binären, Genderqueer- oder anderen Geschlechtsidentitäten identifizieren. Diese Kenntnisse sind wichtig, um in den Bereichen Beschaffung, Verkauf oder anderen kaufmännischen Tätigkeiten erfolgreich zu sein."
1601,Dier Schmied_in formte das heiße Eisen zu einem Hufeisen.,"Die Person, die als Schmied:in arbeitet und das Handwerk des Schmiedens beherrscht, formte das heiße Eisen mit Geschick und Erfahrung zu einem Hufeisen, unabhängig davon, wie sie sich in Bezug auf Geschlecht und Geschlechtsidentität identifiziert, sei es als Mann, Frau, nicht-binär oder in einer anderen Form der Geschlechtsidentität."
1147,Dier Muslim/in betete fünfmal am Tag.,"Die Person, die den Glauben des Islam praktiziert, betet fünfmal am Tag, unabhängig davon, ob sie sich als Muslim, Muslima oder mit einer anderen Geschlechtsidentität identifiziert. Dies umfasst auch alle Menschen, die sich möglicherweise nicht in den binären Geschlechterkategorien von Mann und Frau wiederfinden, aber dennoch Teil der muslimischen Gemeinschaft sind und die religiösen Pflichten und Rituale des Islams wahrnehmen."
571,Ich habe heute einen Friseur_intermin.,"Ich habe heute einen Termin bei einer Friseurperson oder einem Friseur, unabhängig davon, wie diese Person sich in Bezug auf ihr Geschlecht identifiziert. Dies könnte eine Friseurin sein, ein Friseur oder jemand, der sich außerhalb der traditionellen Geschlechtskategorien identifiziert und ebenfalls in diesem Beruf arbeitet."
478,Die Ehrenperson wurde für deren Verdienste ausgezeichnet.,"Die Person, die in diesem Zusammenhang als Ehrenperson anerkannt wurde, hat für ihre oder seine oder deren außergewöhnlichen Verdienste eine Auszeichnung erhalten. Unabhängig davon, wie sich diese Person in Bezug auf Geschlecht und Geschlechtsidentität versteht – sei es als Frau, Mann oder als jemand, der sich außerhalb dieser Kategorien identifiziert – wird ihr Engagement und ihre Leistung gewürdigt."
968,Die hohe KundInzufriedenheit ist das Ergebnis unserer engagierten Arbeit und unseres hervorragenden Services.,"Die hohe Zufriedenheit aller Kunden, Kundeninnen und aller anderen Personen, die unsere Dienstleistungen in Anspruch nehmen und sich dabei mit verschiedenen Geschlechtsidentitäten identifizieren, ist das Ergebnis unserer engagierten Arbeit sowie unseres hervorragenden Services. Wir schätzen die Rückmeldungen und Erfahrungen jedes Einzelnen in unserer vielfältigen Kundschaft, unabhängig davon, ob die Person sich als Mann, Frau oder in einer anderen Geschlechtsidentität versteht."
112,Übermorgen findet die Versammlung von Personen mit Aktienbesitz statt.,"In zwei Tagen wird die Versammlung von Personen, die Aktien besitzen, stattfinden. Dazu gehören alle, die sich als Aktionär, Aktionärin oder in einer anderen Geschlechtsidentität definieren, sowie alle weiteren Interessierten, die in diese Kategorie fallen. Egal, ob sie sich als Frau, Mann oder genderqueer identifizieren oder andere Geschlechtsidentitäten haben, alle sind herzlich willkommen, an der Versammlung teilzunehmen und ihre Perspektiven und Erfahrungen einzubringen."
851,... Jede:r kann teilnehmen.,"'Jede Person, unabhängig von Geschlechtsidentität oder Geschlechtszugehörigkeit, kann an der Teilnahme teilnehmen. Dies schließt Menschen ein, die sich als Frau, Mann oder nicht-binär identifizieren sowie jene, die sich mit weiteren Geschlechtsidentitäten identifizieren, und alle darüber hinaus, die an dieser Aktivität interessiert sind.'"
1437,"Der Patient*inname wurde im System eingegeben, um die medizinischen Unterlagen zu aktualisieren.","Die Person, die unter dem Namen ""Patient*inname"" bekannt ist, wurde in das System eingegeben, um die medizinischen Unterlagen zu aktualisieren. Diese Person kann sich unabhängig von traditionellen Geschlechtsidentitäten als Frau, Mann oder einer anderen Geschlechtsidentität definieren und wird in der medizinischen Dokumentation entsprechend berücksichtigt, um eine umfassende und respektvolle Betreuung zu gewährleisten."
56,"Mein Elternteil hat kommt von der arbeitenden Klasse. Ich bin die erste Person, die studiert hat in der Familie.","Mein Elternteil, der einer Person angehört, die sich aufgrund ihrer sozialen Herkunft der arbeitenden Klasse identifiziert, kommt aus einem Umfeld, in dem Bildung nicht immer als selbstverständlich angesehen wurde. Ich bin die erste Person in meiner Familie, unabhängig von Geschlechtsidentität oder -ausdruck, die die Möglichkeit und die Entscheidung getroffen hat, eine akademische Ausbildung zu verfolgen und zu studieren. Diese Tatsache stellt einen bedeutenden Schritt in der Geschichte meiner Familie dar und zeigt, wie sich Bildungsmöglichkeiten über Generationen hinweg entwickeln können."
1292,Dey ist ein echter Naturmensch und verbringt viel Zeit im Wald.,"Dey, eine Person, die sich als Teil der Natur identifiziert und eine tiefe Verbindung zur Umwelt spürt, verbringt viel Zeit im Wald und genießt es, die ruhige Atmosphäre und die Vielfalt der Pflanzen und Tiere zu erleben. Diese Person schätzt die Schönheit der Natur und findet in diesen Momenten der Stille und der Beobachtung Erfüllung, unabhängig davon, wie sie sich in Bezug auf Geschlecht und Geschlechtsidentität versteht."
1779,Der Minimarkt ist bekannt für seine freundliche Atmosphäre und das vielfältige Sortiment an traditionellen Lebensmitteln.,"Der Minimarkt ist bekannt für die freundliche Atmosphäre, die von allen Mitarbeitenden und dem Kundenstamm geschaffen wird, sowie für das vielfältige Sortiment an traditionellen Lebensmitteln, das für Personen aller Geschlechtsidentitäten, unabhängig von ihrem Geschlecht, ihrer Geschlechtsidentität oder ihrer kulturellen Herkunft, zugänglich ist und deren Bedürfnisse anspricht. Menschen, die den Minimarkt besuchen, egal ob sie sich als Frau, Mann oder mit einer anderen Geschlechtsidentität identifizieren, fühlen sich hier gleichermaßen wohl und willkommen."
126,Dier Animateur:in sorgt für Spaß und Unterhaltung in der Freizeitgruppe.,"Die Person, die als Animateur oder Animateurin tätig ist, unabhängig davon, ob sie sich als Mann, Frau oder mit einer anderen Geschlechtsidentität identifiziert, sorgt dafür, dass in der Freizeitgruppe Spaß und Unterhaltung geboten werden. Diese Person trägt dazu bei, eine angenehme und ansprechende Atmosphäre zu schaffen, die alle Teilnehmer, gleich welcher Geschlechtsidentität, anspricht und einbezieht."
293,Die Berufskraftfahrer*innen sind oft lange auf den Straßen unterwegs.,"Die Personen, die als Berufskraftfahrerinnen, Berufskraftfahrer und in ähnlichen Funktionen tätig sind, verbringen häufig ausgedehnte Zeit auf den Straßen, wobei sie sich mit verschiedenen Geschlechtsidentitäten identifizieren können, die möglicherweise nicht den traditionellen Kategorien entsprechen. Diese Gruppe umfasst somit nicht nur Frauen und Männer, sondern auch nicht-binäre, genderqueere und alle anderen Individuen, die in diesem Berufsfeld arbeiten."
1967,Dier WeinliebhaberIn sammelte edle Flaschen und besuchte regelmäßig Weinfeste und Verkostungen.,"Die Person, die eine Leidenschaft für Wein hegt und als Weinliebhaber oder Weinliebhaberin bezeichnet werden kann, samt all jenen, die sich mit unterschiedlichen Geschlechtsidentitäten identifizieren und eine Affinität zu edlen Weinen besitzen, sammelte kostbare Flaschen und nahm regelmäßig an Weinfesten und Verkostungen teil."
1071,Im Kollegiumszimmer tauschten sich die Lehrkäfte über ihre Erfahrungen und Unterrichtsstrategien aus.,"Im Kollegiumszimmer tauschten sich die Lehrkräfte, dazu gehören sowohl Lehrerinnen als auch Lehrer sowie alle weiteren Personen, die in pädagogischen Positionen tätig sind und sich mit verschiedenen Geschlechtsidentitäten identifizieren, über ihre Erfahrungen und Unterrichtsstrategien aus."
547,Die fahrzeugführende Person des Wagens ABC möge bitte zu ihrem Fahrzeug kommen.,"'Die Person, die das Fahrzeug mit der Kennzeichnung ABC führt, wird darum gebeten, zu ihrem Fahrzeug zu kommen. Dies schließt alle Individuen ein, unabhängig davon, ob sie sich als Frau, Mann oder mit einer anderen Geschlechtsidentität identifizieren. Wir schätzen Vielfalt in Geschlechtsidentitäten und möchten sicherstellen, dass sich jede Person angesprochen und anerkannt fühlt.'"
675,Dier Gäst*inwissenschaftler*in hielt einen Vortrag über deren neuesten Forschungsergebnisse.,"Die Person, die als Gastwissenschaftler oder -wissenschaftlerin eingeladen wurde, sowie alle weiteren Einzelpersonen, die in der Rolle eines Gastforschers oder einer Gastforscherin tätig sind und sich mit unterschiedlichen Geschlechtsidentitäten identifizieren, hielt einen Vortrag über die neuesten Forschungsergebnisse aus ihrem jeweiligen Fachgebiet."
1244,Dier Mittelständler/in ist oft flexibler und schneller bei der Anpassung an Marktveränderungen als große Konzerne.,"Die Person oder das Unternehmen, das im Bereich des Mittelstands tätig ist, unabhängig davon, ob diese Person ein Mann, eine Frau oder eine Person mit einer anderen Geschlechtsidentität ist, zeigt häufig eine größere Flexibilität und Schnelligkeit bei der Anpassung an Veränderungen auf dem Markt im Vergleich zu großen Konzernen. Diese Agilität kann verschiedene Formen annehmen, die durch innovative Strategien, eine enge Kundenbindung oder eine dynamische Reaktion auf aktuelle Entwicklungen charakterisiert sind, und macht den Mittelstand zu einem wichtigen Akteur in der Wirtschaft."
1801,"In der Täter_inrolle nahm dier Schauspieler_in die Herausforderung an, eine komplexe Figur zu verkörpern.","In der Rolle der Täter_in, die sowohl männliche, weibliche als auch nicht-binäre und andere Geschlechtsidentitäten umfasst, nahm die Person, die in diesem Kontext als Schauspieler oder Schauspielerin agiert und sich möglicherweise mit verschiedenen Geschlechtsidentitäten identifiziert, die Herausforderung an, eine komplexe Figur mit vielfältigen Charakterzügen und motivationsbedingten Facetten zu verkörpern."
725,Das Gründer/inzentrum bot Start-ups umfassende Unterstützung und Ressourcen.,"Das Gründer*innenzentrum, als eine Einrichtung, die darauf abzielt, neu gegründeten Unternehmen und Initiativen aller Art, unabhängig von deren Geschlechtsidentität der Gründerinnen, Gründer und aller anderen beteiligten Personen, umfassende Unterstützung und Ressourcen zur Verfügung zu stellen, bot Start-ups eine Vielzahl von Möglichkeiten zur Förderung und Weiterentwicklung ihrer Geschäftsideen."
524,Die landwirtschaftlichen Erzeuger/innen stellten frische Produkte bereit.,"Die Personen, die in der Landwirtschaft tätig sind und landwirtschaftliche Erzeugnisse produzieren, unabhängig davon, ob sie sich als Erzeuger, Erzeugerin oder mit einer anderen Geschlechtsidentität identifizieren, haben frische Produkte bereitgestellt."
1666,"Dier SchlepperIn half dabei, die schweren Container von der Schiffs- zur Lagerhalle zu transportieren.","Die Person, die als Schlepper oder Schlepperin arbeitet, hat dabei geholfen, die schweren Container vom Schiff zur Lagerhalle zu transportieren. Dabei ist es unwesentlich, ob diese Person sich als Mann, Frau, oder mit einer anderen Geschlechtsidentität identifiziert; wichtig ist die Beitragsleistung, die zur erfolgreichen Durchführung dieser Aufgabe geleistet wird."
382,"Als Callcenteroperator ist es deren Aufgabe, die Anliegen der AnruferInnen professionell zu bearbeiten.
","'Die Personen, die als Callcenteroperatoren oder Callcenteroperatorinnen tätig sind, haben die wichtige Aufgabe, die Anliegen der Anruferinnen, Anrufer und aller anderen Personen, die anrufen und sich mit verschiedenen Geschlechtsidentitäten identifizieren, professionell zu bearbeiten. Dabei spielt es keine Rolle, wie sich diese Personen in Bezug auf ihr Geschlecht oder ihre Geschlechtsidentität verstehen; alle sind gleichermaßen dazu aufgerufen, die Anliegen der Anrufenden aufmerksam und respektvoll zu behandeln.'"
776,Heute gibt es gut bürgerliche Küche: Kartoffeln mit Sauerkraut.,"Heute werden Gerichte aus der gut bürgerlichen Küche serviert, insbesondere Kartoffeln mit Sauerkraut, die von allen Personen geschätzt werden, unabhängig von ihrem Geschlecht oder ihrer Geschlechtsidentität. Diese Speisen laden ein, von Menschen aller Altersgruppen und Hintergründe genossen zu werden. Es spielt keine Rolle, ob die Gäste sich als Männer, Frauen oder mit einer anderen Geschlechtsidentität identifizieren; die gutbürgerliche Küche ist für jeden und jede zugänglich und bereitet allen Freude."
1480,Die Rentner:innen suchen nach einer schönen Parkanlage. ,"Die Personen, die im Ruhestand sind, unabhängig davon, ob sie sich als Rentner, Rentnerin oder mit einer anderen Geschlechtsidentität identifizieren, suchen nach einer schönen Parkanlage, die Raum für Erholung und Begegnung bietet und in der sie ihre Freizeit genießen können."
1891,Die die Maschine verwendende Person muss eine Sicherheitsunterweisung absolvieren.,"Die Person, die die Maschine bedient oder verwendet, ganz gleich, wie sie sich geschlechtlich identifiziert – sei es als Frau, Mann, nicht-binär, genderqueer, agender oder durch eine andere Geschlechtsidentität – muss vor der Nutzung eine Sicherheitsunterweisung absolvieren. Diese Unterweisung trägt dazu bei, dass alle, unabhängig von ihrer Geschlechtsidentität, die erforderlichen Kenntnisse und Fähigkeiten erwerben, um die Maschine sicher und verantwortungsvoll zu nutzen."
1417,Ein:e prominente:r Schauspieler:in besuchte die Veranstaltung.,"Eine prominente Persönlichkeit aus der Schauspielbranche, die sich möglicherweise als Schauspieler, Schauspielerin oder mit einer anderen Geschlechtsidentität versteht, besuchte die Veranstaltung. Diese Person könnte in der Film-, Fernseh- oder Theaterwelt bekannt sein und wird aufgrund ihrer Beiträge und Leistungen in dieser Branche geschätzt."
1619,Die seefahrende Person liebte das Leben auf See.,"Die Person, die sich dem Seefahren widmet, unabhängig davon, ob sie sich als Frau, Mann oder mit einer anderen Geschlechtsidentität identifiziert, liebte das Leben auf See und die vielfältigen Erfahrungen, die es mit sich bringt, sowie die besondere Verbundenheit zur Natur und den Herausforderungen, die das Leben auf dem Wasser mit sich bringt."
845,Dier Interessensvertreter*in sprach vor dem Parlament über die Anliegen derer Branche.,"Die Person, die als Interessenvertreterin, Interessenvertreter oder in einer anderen geschlechtlichen Identität auftritt, hielt eine Rede vor dem Parlament, in der sie die Anliegen der Fachbranche vertrat. Diese Person kann sich als Frau, Mann oder als jemand mit einer nicht-binären Identität oder einer anderen geschlechtlichen Orientierung definieren und trug dazu bei, die vielfältigen Perspektiven und Anliegen der verschiedenen Mitglieder dieser Branche zu vertreten."
66,Die ArchivarInnen bewahren historische Manuskripte auf.,"Die Personen, die in der Archivarbeit tätig sind und sich in diesem Kontext als Archivare oder Archivaren identifizieren, sowie alle anderen Menschen, unabhängig von ihrer Geschlechtsidentität – seien sie Frauen, Männer oder Nicht-binäre, genderqueere Personen oder anderen Geschlechtsidentitäten – bewahren historische Manuskripte auf."
1665,Die Schlagperson erzielte im Cricket-Match einige wichtige Runs für das Team.,"Die Person, die als Schlagkraft im Cricket-Match fungierte, konnte einige wichtige Runs für das Team erzielen, unabhängig von ihrer Geschlechtsidentität oder Geschlechtszugehörigkeit, sei es als Mann, Frau oder sonstigen Identitäten, die möglicherweise nicht in die traditionellen Kategorien passen."
1151,Der auffällige Leberfleck wurde kleiner.,"Der auffällige Leberfleck, der bei einer Person sichtbar ist und möglicherweise von verschiedenen Geschlechtsidentitäten und individuellen Merkmalen betroffen ist, hat sich in seiner Größe verringert. Dabei spielt es keine Rolle, ob die Person, die diesen Leberfleck hat, sich als Frau, Mann oder mit einer anderen Geschlechtsidentität identifiziert; die Veränderung der Größe betrifft alle Menschen unabhängig von ihrer Geschlechtszugehörigkeit."
1068,"Der Lehrer/inberuf erfordert nicht nur Fachwissen, sondern auch pädagogisches Geschick.","Der Beruf der Lehrperson, unabhängig davon, ob sich die Lehrkraft als Lehrer oder Lehrerin identifiziert, oder einer anderen Geschlechtsidentität angehört, erfordert nicht nur fundiertes Fachwissen in dem jeweiligen Unterrichtsfach, sondern auch ein ausgeprägtes pädagogisches Geschick, um die unterschiedlichen Lernbedürfnisse und -stile der Schülerinnen, Schüler und aller weiterer Lernenden, die den Unterricht besuchen, effektiv zu unterstützen und zu fördern."
1476,Dier Referendar*in absolvierte deren Praktikum an der Schule.,"Die Person, die sich in der Ausbildung zum Lehrberuf befindet und das Referendariat durchläuft, absolvierte das Praktikum an der Schule. Diese Person kann sich als Frau, Mann oder mit einer anderen Geschlechtsidentität identifizieren und macht wichtige Erfahrungen, um ihre Fähigkeiten als zukünftige Lehrkraft zu entwickeln."
1658,"Die Sachbearbeiter/innummer wurde in das System eingegeben, um den Fall zuzuordnen.","Die Person, die für die Bearbeitung des Falls zuständig ist, egal ob sie sich als Sachbearbeiter, Sachbearbeiterin oder mit einer anderen Geschlechtsidentität identifiziert, hat ihre individuelle Sachbearbeiternummer in das System eingegeben, um den Fall korrekt zuzuordnen."
86,Die AuftragnehmerInnen lasen den Vertrag vorab gründlich durch.,"Die Personen, die als Auftragnehmerinnen, Auftragnehmer und in verschiedenen anderen Geschlechtsidentitäten aktiv sind, haben den Vertrag im Vorfeld sorgfältig und gründlich durchgelesen, um alle relevanten Aspekte zu verstehen und sicherzustellen, dass sie gut informiert in den bevorstehenden Prozess eintreten."
1121,Dier Mechatroniker_in war entscheidend für die reibungslose Wartung und Reparatur der Produktionsmasch_inen verantwortlich.,"Die Person, die im Bereich der Mechatronik tätig ist und sich möglicherweise als Mechatroniker, Mechatronikerin oder mit einer anderen Geschlechtsidentität identifiziert, war entscheidend verantwortlich für die reibungslose Wartung und Reparatur der Produktionsmaschinen. Diese Person hat durch ihre Fähigkeiten und ihr Engagement einen wesentlichen Beitrag zur Effizienz und Verfügbarkeit der Maschinen geleistet, unabhängig von ihrer Geschlechtsidentität oder den gesellschaftlichen Normen, die damit verbunden sein mögen."
560,Dier Follower*in wartete gespannt auf das nächste Video.,"Die Person, die diesem Kanal auf den sozialen Medien folgt, unabhängig davon, ob sie sich als Frau, Mann oder mit einer anderen Geschlechtsidentität identifiziert, wartete gespannt auf das nächste Video."
1384,Dier PastorIn hielt eine bewegende Predigt.,"Die Person, die als Pastor oder Pastorin tätig ist und eine bedeutende Rolle innerhalb der religiösen Gemeinschaft spielt, unabhängig davon, ob sie sich als Frau, Mann oder in einer anderen geschlechtlichen Identität versteht, hielt eine bewegende Predigt, die viele Anwesende tief berührte und zum Nachdenken anregte."
528,Dier Evaluator_in bewertete das Projekt nach festen Kriterien.,"Die Person, die als Evaluator oder Evaluatorin tätig ist, sowie alle weiteren Personen, die diese Rolle übernehmen und sich möglicherweise nicht innerhalb der traditionellen Geschlechtskategorien identifizieren, bewertete das Projekt anhand festgelegter Kriterien, die dazu dienen, eine gerechte und umfassende Bewertung zu gewährleisten."
1254,Die Nachbar*innen luden zum Grillfest ein.,"Die Nachbarinnen, Nachbarn und alle anderen Personen, die in der Nachbarschaft leben und sich mit unterschiedlichen Geschlechtsidentitäten identifizieren, luden herzlich zu einem Grillfest ein."
370,Dier Chirurg/in führte eine komplizierte Operation erfolgreich durch.,"Die Person, die als Chirurg oder Chirurgin arbeitet und über die notwendigen Qualifikationen und Erfahrungen verfügt, und die möglicherweise auch andere Geschlechtsidentitäten hat oder sich außerhalb der traditionellen Geschlechterkategorien identifiziert, hat eine komplizierte Operation erfolgreich durchgeführt."
1737,"Die Strohpersonen in der Organisation wurden eingesetzt, um illegale Geschäfte zu verschleiern.","Die Personen, die als Strohpersonen innerhalb der Organisation fungieren, wurden eingesetzt, um die Durchführung illegaler Geschäfte zu verschleiern. Dabei ist es wichtig zu betonen, dass diese Strohpersonen in ihrer Geschlechtsidentität vielfältig sein können und sich als Frauen, Männer oder in einer anderen Geschlechtsidentität definieren können. Sie repräsentieren somit eine breite Palette von Geschlechtsidentitäten und -ausdrücken und tragen zu einem komplexen gesellschaftlichen Kontext bei, der das Verständnis in Bezug auf Identität und Rolle innerhalb der Organisation betrifft."
1669,Die (Er-)Schaffenden der neuen Programme hatten viel Arbeit vor sich. ,"Die Personen, die an der Entwicklung und Kreation der neuen Programme beteiligt sind, hatten viel Arbeit vor sich, ganz gleich, ob sie sich als Frauen, Männer oder mit einer anderen Geschlechtsidentität identifizieren. Diese Gruppe umfasst somit alle Erschaffenden und Kreativen, die sich in verschiedenen Rollen engagieren und unterschiedliche Perspektiven sowie Erfahrungen in den Prozess einbringen."
1602,Die Schriftsteller*innen veröffentlichten ihren ersten Roman.,"Die Schriftstellerinnen, Schriftsteller und alle anderen Personen, die Texte verfassen und sich mit unterschiedlichen Geschlechtsidentitäten identifizieren, haben ihren ersten Roman veröffentlicht."
1521,"Die Rehasport ausübende Person nutzte die spezielle Sporttherapie, um ihre Beweglichkeit zurückzugewinnen.","Die Person, die Rehasport praktiziert, unabhängig von ihrer Geschlechtsidentität, nutzt die spezielle Sporttherapie, um ihre Beweglichkeit zurückzugewinnen. Dabei handelt es sich um eine individuelle Therapieform, die für alle Menschen geeignet ist, die sich in einer Rehabilitationsphase befinden und die ihre körperliche Beweglichkeit verbessern möchten, gleichgültig, ob sie sich als Frau, Mann oder mit einer anderen Geschlechtsidentität verstehen."
1994,Dier ZuliefererIn hat die benötigten Materialien pünktlich geliefert.,"Die Person, die als Zulieferin oder Zulieferer tätig ist und die benötigten Materialien bereitstellt, hat diese pünktlich geliefert, unabhängig davon, ob sie sich als Frau, Mann oder mit einer anderen Geschlechtsidentität identifiziert."
257,Dier BürgerIn stimmte über das neue Bauprojekt ab.,"Die Person, die als Bürgerin, Bürger oder in einer anderen Geschlechtsidentität betrachtet wird, hat über das neue Bauprojekt abgestimmt. Dabei sind alle Menschen eingeschlossen, die im jeweiligen Gebiet leben und sich unabhängig von konventionellen Geschlechtskategorien als Bürgerinnen, Bürger oder mit einer anderen Geschlechtsidentität identifizieren."
1415,Unsere Projektbeteiligten unterstützen uns bei der Umsetzung.,"Die Personen, die an unserem Projekt beteiligt sind, unterstützen uns aktiv bei der Umsetzung der verschiedenen Aufgaben und Ziele. Dies schließt alle Geschlechtsidentitäten ein, unabhängig davon, ob sie sich als Männer, Frauen, nicht-binär, genderqueer oder in anderer Weise identifizieren. Wir schätzen die Vielfalt und die unterschiedlichen Perspektiven, die jede einzelne dieser Personen mit in das Projekt einbringt."
1910,ein Bündnis einhaltende Person  verbündete Person,"Eine Person, die sich aktiv für die Förderung und Einhaltung von Bündnissen sowie für die solidarische Unterstützung anderer Menschen einsetzt, unabhängig davon, wie sie sich in Bezug auf ihr Geschlecht oder ihre Geschlechtsidentität versteht, oder ob sie sich als Verbündete, Verbündeter oder mit einer anderen Identität sieht, wird hier beschrieben."
